Title,Description
Ψήφος στο Αρκαλοχώρι Ηρακλείου,"Καλώ κάθε Ελληνίδα και κάθε Έλληνα, κάθε δημοκράτη, προοδευτικό πολίτη, ό,τι και αν επέλεξε στις 21 Μαΐου, να στηρίξει το ΠΑΣΟΚ, τη Δημοκρατική Παράταξη, σε αυτήν τη νέα της πορεία.

Είναι ο μόνος τρόπος για να μην έχουμε άλλα τέσσερα χαμένα χρόνια στο πολιτικό μας σύστημα με μια αναποτελεσματική αντιπολίτευση και μια αλαζονική, πελατειακή κυβέρνηση, που οι επιλογές της καθημερινά αποδομούν το κοινωνικό κράτος.

Από τη δική μας πλευρά, δεσμεύομαι ότι θα είμαστε η δύναμή τους. Μέσα και έξω από το ελληνικό κοινοβούλιο, με αγώνες. 
Αγκαλιάζοντας τις αγωνίες τους, τις ελπίδες τους, τις ανάγκες τους.

Ισχυρή Δημοκρατική Παράταξη απόψε, σημαίνει ότι θα υπάρχει ισχυρή, αξιόπιστη, προοδευτική δύναμη απέναντι στη συντήρηση, την αναξιοκρατία και την αδιαφάνεια."
Απόψε συναντήθηκε η ιστορική μνήμη με την ελπίδα για καλύτερες μέρες,
Live | Κεντρική Ομιλία του Νίκου Ανδρουλάκη στo Ηράκλειο,#live
27 χρόνια χωρίς τον Ανδρεα Παπανδρέου,
Live | Συνέντευξη στο κεντρικό δελτίο ειδήσεων του Mega με τη Ράνια Τζίμα,#live
Όλοι μαζί για τη μεγάλη νίκη. Για την αναγέννηση της Δημοκρατικής Παράταξης.,"Σας ευχαριστώ για τη συγκλονιστική σας παρουσία και δεσμεύομαι ότι θα αγωνιστώ καθημερινά για να μην απογοητεύσω κανέναν σε αυτήν τη νέα σχέση εμπιστοσύνης, που οικοδομήσαμε. Όλοι μαζί για τη μεγάλη νίκη. Για την αναγέννηση της Δημοκρατικής Παράταξης."
Live | Κεντρική Ομιλία του Νίκου Ανδρουλάκη στην ΑΘήνα,#live
"Live | Συνέντευξη στην εκπομπή ""Καλημέρα Ελλάδα"" με τον Γιώργο Παπαδάκη και την Μαρία Αναστασοπούλου",#live
Η Πάτρα έστειλε ισχυρό μήνυμα Αλλαγής!,
Ομιλία στην Πάτρα,#live
Live | Συνέντευξη στο Κεντρικό Δελτίο Ειδήσεων του Alpha με τον Αντώνη Σρόιτερ,#live
Ομιλία στη Θεσσαλονίκη,
Live | Ομιλία στη Θεσσαλονίκη,#live
Περιοδεία στο Ηράκλειο Κρήτης,"Ισχυρό ΠΑΣΟΚ στις 25 Ιουνίου, σημαίνει ισχυρή, αξιόπιστη, προοδευτική δύναμη για να αντιμετωπίσει την αλαζονεία και την αναξιοπιστία της κυβέρνησης του κ. Μητσοτάκη."
"Συνέντευξη στον Alpha και στην εκπομπή ""Καλύτερα δεν γίνεται"" με τη Ναταλία Γερμανού",#live
"Συνέντευξη στο STAR Κεντρικής Ελλάδας, με τον Γιώργο Σιμόπουλο",#live
Το ΠΑΣΟΚ μπορεί να αναγεννήσει το Εθνικό Σύστημα Υγείας,
Το ΠΑΣΟΚ μπορεί να στηρίξει την οικογένεια,
Το ΠΑΣΟΚ μπορεί να προσφέρει δεύτερη ευκαιρία στους αδύναμους δανειολήπτες,
Το ΠΑΣΟΚ μπορεί να διασφαλίσει αξιοπρεπείς συντάξεις,
Το ΠΑΣΟΚ μπορεί να ενισχύσει την Δημόσια Παιδεία,
"Στις 25 Ιουνίου, μαζί κάνουμε την αλλαγή δυνατή","To ΠΑΣΟΚ με τη δική σας στήριξη, μπήκε σε μια νέα πορεία. Θα είμαστε δίπλα σε όλους εσάς που μας εμπιστευτήκατε, μα και δίπλα σε κάθε Έλληνα και Ελληνίδα. Θα είμαστε η σοβαρότητα, η ευθύνη, η ειλικρίνεια που χρειάζεται η χώρα και θα αγωνιστούμε για όλα εκείνα που έχει ανάγκη η κοινωνία.

Στις 25 Ιουνίου, μαζί κάνουμε την αλλαγή δυνατή."
Συνέντευξη στο Action 24 με τον Γιώργο Πιέρρο & τον Βασίλη Τσεκούρα,#live
Live | Ομιλία στο Ρέθυμνο,#live
Live | Συνέντευξη στο Mega,#live
Δίστομο | Έχουμε χρέος να διεκδικήσουμε τις γερμανικές επανορθώσεις,"Τιμούμε τη μνήμη των Διστομιτών, που σφαγιάστηκαν από τα ναζιστικά γερμανικά στρατεύματα κατοχής.

Είμαστε εδώ, γιατί έχουμε χρέος να διατηρήσουμε ζωντανή την ιστορική μνήμη, που είναι φρουρός για να μην επαναληφθούν τέτοιες τραγωδίες, τέτοια αποτρόπαια εγκλήματα εις βάρος της ανθρωπότητας.

Έχουμε χρέος επίσης να διεκδικήσουμε τις γερμανικές επανορθώσεις. Για εμάς είναι ένα εθνικό ζήτημα και θα αγωνιστούμε με κάθε πολιτικό και νομικό μέσο.

Άλλωστε, στελέχη του ΠΑΣΟΚ κι εδώ από τη Βοιωτία, -με τον Γιάννη Σταμούλη-, ξεκίνησαν αυτόν τον αγώνα και θα τον ολοκληρώσουμε με κάθε πολιτικό και νομικό μέσο."
Live | Ομιλία στην Τρίπολη,#live
Live | Ομιλία στον Βόλο,#live
Περιοδεία στην Κατερίνη,"Είμαστε ο χώρος που αγωνίζεται για τις ιδέες της κοινωνικής δικαιοσύνης, της εθνικής αξιοπρέπειας και εγγυόμαστε ότι θα αναγεννήσουμε το Εθνικό Σύστημα Υγείας και θα οικοδομήσουμε μια δημόσια παιδεία που θα δίνει ευκαιρίες σε όλα τα ελληνόπουλα.
Αυτές είναι οι πραγματικές αγωνίες του λαού, που αγκαλιάζουμε και στις 25 Ιουνίου προχωράμε μαζί σε μια νέα εποχή."
"Live | Συνέντευξη στον ΣΚΑΪ 100,3 [B' Μέρος]",#live
"Live | Συνέντευξη στον ΣΚΑΪ 100,3",#live
Live | Συνέντευξη στο Kontra με την Αναστασία Γιάμαλη,
Περιοδεία στην Καλλιθέα,
Επίσκεψη στην Καλλιθέα,"Οι ελλείψεις προσωπικού στο ΕΚΑΒ, στα πρωτοβάθμια Κέντρα Υγείας και γενικότερα στο ΕΣΥ έχουν τραγικά αποτελέσματα για τον ελληνικό λαό. Η κυβέρνηση δεν χρησιμοποιεί σωστά τα δισεκατομμύρια του Ταμείου Ανάκαμψης, ώστε να δημιουργήσουμε ένα σύγχρονο ΕΣΥ, με υπηρεσίες σε όλη την Ελλάδα."
Επίσκεψη στην Κεντρική Υπηρεσία του ΕΚΑΒ,"Οι ελλείψεις προσωπικού στο ΕΚΑΒ, στα πρωτοβάθμια Κέντρα Υγείας και γενικότερα στο ΕΣΥ έχουν τραγικά αποτελέσματα για τον ελληνικό λαό. Η κυβέρνηση δεν χρησιμοποιεί σωστά τα δισεκατομμύρια του Ταμείου Ανάκαμψης, ώστε να δημιουργήσουμε ένα σύγχρονο ΕΣΥ, με υπηρεσίες σε όλη την Ελλάδα."
Περιοδεία στο Μαρούσι,
Περιοδεία στο Μαρούσι,
Live | Συνέντευξη στο OPEN,#live
Live | Ομιλία στη Ρόδο,#live
Ομιλια στη Σητεία,
Live | Συνέντευξη στο Κεντρικό Δελτίο Ειδήσεων του ΣΚΑΪ με τη Σία Κοσσιώνη,#live
Ομιλία στην Χίο,
Ομιλία του Νίκου Ανδρουλάκη,#live
Ζωντανά στο Κεντρικό Δελτίο Ειδήσεων του Ant1 με τον Νίκο Χατζηνικολάου,#live
Δήλωση στο Προεδρικό Μέγαρο μετά τη συνάντηση με την Πρόεδρο της Δημοκρατίας,#live
Ζωντανά από την Χαριλάου Τρικούπη,#live
Ήρθε η ώρα του κυρίαρχου Ελληνικού λαού,"Καλώ κάθε Ελληνίδα και κάθε Έλληνα, με ελπίδα και αισιοδοξία, να στηρίξει την προσπάθεια που κάνουμε. 
Δεσμεύομαι ότι θα αγωνιστώ με όλες μου τις δυνάμεις για ένα ισχυρό κοινωνικό κράτος, που θα μειώσει τις ανισότητες, με δημόσια υγεία, με δημόσια παιδεία, με ίσες ευκαιρίες για όλα τα ελληνόπουλα και, βέβαια, μία βιώσιμη ανάπτυξη, που θα σέβεται το περιβάλλον και τον άνθρωπο.

Τους καλώ να γυρίσουν την πλάτη στην τοξικότητα, στη διχόνοια. Να γυρίσουν την πλάτη σε όσους περιφρονούν τα πραγματικά τους προβλήματα. 
Σε όσους τα κάνουν όλα μόνο για την εξουσία. Είναι ικανοί να γίνουν ικέτες των ψήφων της Χρυσής Αυγής. Και, από την άλλη, να στήσουν ένα παρακράτος εις βάρος της Δημοκρατίας και του ελληνικού λαού.

Σήμερα, ήρθα να ασκήσω το εκλογικό μου δικαίωμα στον τόπο καταγωγής μου, το Αρκαλοχώρι. Για να υπογραμμίσω ποιο ήταν το επιτελικό κράτος του κ. Μητσοτάκη. Ήταν ένα περίβλημα του χάους και του πελατειασμού. Και αυτό αποδεικνύεται από το γεγονός ότι, δύο χρόνια μετά τον σεισμό, οι πολίτες του Αρκαλοχωρίου συνεχίζουν να ζουν κάτω από δραματικές συνθήκες στα κοντέινερ. 

Γι’ αυτό, λοιπόν, ελληνικέ λαέ, σου αξίζουν πολύ περισσότερα. Και είμαστε εδώ, στη νέα αυτή προσπάθεια, να σου τα προσφέρουμε."
Live | Κεντρική Ομιλία στο Ηράκλειο,
Live | Συνέντευξη στην εκπομπή Καλημέρα Ελλάδα με τον Γιώργο Παπαδάκη και την Μαρία Αναστασοπούλου,#live
A' μέρος | Συνέντευξη στην εκπομπή Happy Day στον Alpha με τη Σταματίνα Τσιμτσιλή,#live
Live | Συνέντευξη στο Κεντρικό Δελτίο Ειδήσεων του MEGA με τη Ράνια Τζίμα,#live
Κεντρική ομιλία στη Θεσσαλονίκη,
"Στις 21 Μαΐου δεν έχεις δίλημμα. Ψηφίζεις αξιοκρατία, αξιοπρέπεια, προοπτική",
B' Μέρος | Συνέντευξη στην εκπομπή Happy Day στον Alpha με τη Σταματίνα Τσιμτσιλή,#live
B' μέρος | Ζωντανά στον Real FM με τον Νίκο Χατζηνικολάου,#live
Ζωντανά από το Θησείο | Κεντρική Ομιλία στην Αθήνα,#live
Ζωντανά στον Real FM με τον Νίκο Χατζηνικολάου,#live
Ζωντανά στο κεντρικό δελτίο είδήσεων του Alpha με τον Αντώνη Σρόιτερ,#live
Συνέντευξη στο Blue Sky,#live
Ομιλία στη Θεσσαλονίκη,#live
Ομιλία στα Χανιά,#live
Ομιλία στα Χανιά,#live
Συνέντευξη στη Νέα Τηλεόραση Κρήτης,
Συνέντευξη στο Kontra Channel με την Αναστασία Γιάμαλη,
Ομιλία στην Πάτρα,
"Ελλάδα #μεΠΑΣΟΚ, Ελλάδα με αξιοκρατία, αξιοπιστία και προοπτική",
Ζωντανά στο κεντρικό δελτίο ειδήσεων του Ant1 με τον Νίκο Χατζηνικολάου,#live
"Ζωντανά στον ΣΚΑΪ 100,3 με τον Παύλο Τσίμα",#live
Ζωντανά το Debate των Πολιτικών Αρχηγών,#live
Συνέντευξη στην Τηλεόραση Creta με τον Σωτήρη Μεταξά,#live
Συνέντευξη στο Κεντρικό Δελτίο Ειδήσεων του STAR,#live
The 2night Show με τον Γρηγόρη Αρναούτογλου,#live
Β' μέρος / The 2night Show με τον Γρηγόρη Αρναούτογλου,#live
Ομιλία στη Λάρισα,#live
Ομιλία στη Λάρισα,#live
Επίσκεψη στη Νέα Σμύρνη,"Εμπιστευθείτε μας διότι έχουμε υψηλό δείκτη και αξιοπιστίας και γνώσης για να οικοδομήσουμε την Ελλάδα του πραγματικού 21ου αιώνα και όχι την Ελλάδα του παρακράτους, των υποκλοπών, του ρουσφετιού, της διχόνοιας, της τοξικότητας, των παρακρατικών μηχανισμών στα social media που ισοπεδώνουν προσωπικότητες, ανθρώπινα δικαιώματα και τη διάκριση εξουσιών."
Παρουσίαση προγραμματικών προτεραιοτήτων του ΠΑΣΟΚ - Κινήματος Αλλαγής,#live
Συνέντευξη Νίκου Ανδρουλάκη στον τηλεοπτικό σταθμό OPEN,
Ομιλία στον Πύργο,#live
Ομιλία στην Κομοτηνή,#live
"Ζωντανά στην εκπομπή ""Κοινωνία Ώρα Mega""",#live
Συνέντευξη στο Delphi Economic Forum,#live
Ομιλία στα Ιωάννινα,#live
Ομιλία στο Αγρίνιο,#live
Ομιλία στα Τρίκαλα,#live από το Μουσείο Τσιτσάνη
Επίσκεψη στις φυλακές Ωρωπού,
Ζωντανά από την Μυτιλήνη,#live
Ζωντανά από την Μυτιλήνη,#live
Μητσοτάκης και Τσίπρας είναι απολύτως υπεύθυνοι για τη λειτουργία ενός ψηφιακού παρακράτους,"«Η προάσπιση των ανθρωπίνων δικαιωμάτων είναι προτεραιότητα κάθε πολιτισμένης κοινωνίας. Θεωρώ, λοιπόν, αδιανόητο αυτό που συμβαίνει στο διαδίκτυο, και όχι μόνο, τις τελευταίες ώρες. 
Ο κ. Μητσοτάκης και ο κ. Τσίπρας είναι απολύτως υπεύθυνοι για τη λειτουργία ενός ψηφιακού παρακράτους, “κουκουλοφόρων”, ψηφιακών συμμοριών, που στοχοποιούν  προσωπικότητες ανθρώπων, που είτε θεωρούν ότι μπαίνουν εμπόδιο στα σχέδια τους είτε για άλλους δικούς τους λόγους. 
Θεωρώ ότι κάθε δημοκράτης και προοδευτικός πολίτης έχει χρέος να σταθεί απέναντι σε αυτές τις απάνθρωπες πρακτικές. Είναι πρακτικές, που δεν αξίζουν σε μία ευρωπαϊκή χώρα. Δεν αξίζουν στην Ελλάδα της Δημοκρατίας, στην Ελλάδα των αγώνων για το Κράτος Δικαίου. Γι΄ αυτό, έχουμε χρέος να σταθούμε απέναντι σε όλους εκείνους, που δεν καταλαβαίνουν ότι έχουν περάσει πάρα πολλά χρόνια από την εποχή, που αυτές οι πρακτικές γίνονταν αποδεκτές. Έχουμε τη δύναμη να εναντιωθούμε σε αυτό το ψηφιακό παρακράτος, το οποίο υποβαθμίζει κάθε έννοια κράτους δικαίου και ανθρωπίνων δικαιωμάτων»."
Βάλ'το αγόρι μου! Συνέντευξη με τον Βασίλη Σκουντή,
"Το Αναστάσιμο Φως, ας σημάνει μια πραγματικά νέα αρχή",
Περιοδεία στη Δημοτική αγορά του Πειραιά,
"Ποιο είναι το πρόσωπο, που έχει στο μυαλό του ο Νίκος Ανδρουλάκης; [Part 2]",
"Ποιο είναι το πρόσωπο, που έχει στο μυαλό του ο Νίκος Ανδρουλάκης; [Part 1]",
"Συνέντευξη στον Ant1 και στην εκπομπή ""Καλημέρα Ελλάδα""",#live
Η υπόθεση των υποκλοπών δεν θα παραγραφεί ούτε πολιτικά ούτε ποινικά,"Ο Πρόεδρος του ΠΑΣΟΚ-Κινήματος Αλλαγής, Νίκος Ανδρουλάκης, συναντήθηκε το πρωί με τον Προϊστάμενο της Εισαγγελίας Πρωτοδικών Αθηνών, κ. Ελευθεριάνο προκειμένου να καταθέσει αίτηση επίσπευσης της εισαγγελικής έρευνας για την υπόθεση των υποκλοπών.

Ο κ. Ανδρουλάκης προχώρησε στην ακόλουθη δήλωση:
«Ήρθα σήμερα εδώ, που χτυπά η καρδιά της Δικαιοσύνης και κατέθεσα στον κ. Ελευθεριάνο αίτηση επίσπευσης της εισαγγελικής έρευνας, που αφορά το ζήτημα των υποκλοπών. 
Η υπόθεση αυτή δεν θα παραγραφεί ούτε πολιτικά ούτε ποινικά. Και να είναι σίγουροι οι υπεύθυνοι ότι θα αναλάβουν πλήρως τις ευθύνες τους.
Η Ελλάδα είναι μια χώρα ισχυρού κράτους δικαίου. Είναι μια ευρωπαϊκή χώρα κι έχουμε χρέος, -όλο το πολιτικό σύστημα- να μην επιτρέψουμε να εκτεθεί ξανά η χώρα μας διεθνώς με τέτοιες ποινικά απαράδεκτες πράξεις εις βάρος πολιτών, εις βάρος των ανθρώπινων δικαιωμάτων»."
Ομιλία στις Σέρρες,#live
Τέλος στις διορισμένες διοικήσεις οργανισμών και νοσοκομείων.,
"Με ισχυρό διψήφιο ποσοστό, προγραμματικές συγκλίσεις και συζήτηση για πρόσωπα κοινής αποδοχής.",
"Kάνε τον θυμό, απόφαση αλλαγής","Αυτή η χώρα, γεννά θυμό, γιατί αποφασίζουμε για εκείνη πάντα με θυμό.
Όμως αυτό πρέπει να το αλλάξουμε.
Και μαζί να αποφασίσουμε σε τι χώρα θέλουμε να ζούμε.
Μπες στο digitalsociety.gr και κάνε τον θυμό, απόφαση αλλαγής."
Την 21η Μαΐου σας καλώ να πάρουμε μαζί απόφαση αλλαγής,"Μετά από μήνες αντιθεσμικής σεναριολογίας, που καλλιέργησε ο Πρωθυπουργός ψάχνοντας εναγωνίως σωσίβιο προσωπικής επιβίωσης, σήμερα ανακοίνωσε το τέλος της αποτυχημένης διακυβέρνησης του.

Επιχείρησε, μάλιστα, να προσδιορίσει ημερολογιακά και τις δεύτερες εκλογές, περιφρονώντας την έκφραση της βούλησης του ελληνικού λαού, αλλά και το ίδιο το Σύνταγμα.

Οι Ελληνίδες και οι Έλληνες στις εκλογές της 21ης Μαΐου ψηφίζουν για μια νέα ελπίδα. Για μια νέα προοπτική.

Η Κυβέρνηση Μητσοτάκη χαρακτηρίζεται από την κατάρρευση του δήθεν επιτελικού κράτους, τις πελατειακές σχέσεις, την αύξηση των κοινωνικών ανισοτήτων, την υπονόμευση του κράτους δικαίου και των ανεξάρτητων αρχών αλλά και τα εκτεταμένα φαινόμενα διαφθοράς.

Οι πολίτες ψηφίζουν για την Ελλάδα στην οποία αξίζει να ζούμε.

Για το κράτος που θα εγγυάται το δημόσιο συμφέρον, την κοινωνική δικαιοσύνη, τη δίκαιη ανάπτυξη, τη διαφάνεια και την αξιοκρατία.
Σε μια οικονομία ανθεκτική, βιώσιμη, ελληνική, με αξιοπρέπεια και ευημερία για όλους.

Την 21η Μαΐου σας καλώ να πάρουμε μαζί απόφαση αλλαγής."
Ομιλία στη Σπάρτη,#live
Συνέντευξη στην ΕΡΤ με τον Απόστολο Μαγγηριάδη,#live
"Ομιλία στο Ηράκλειο - Ανθεκτική Οικονομία, Δίκαιη Κοινωνία, Ισχυρή Ελλάδα",#live
Συνέντευξη στο Ράδιο Θεσσαλονίκη,#live
Συζήτηση για την ασφάλεια των σιδηροδρομικών δικτύων,
"[B ΜΕΡΟΣ] Συνέντευξη στον Alpha και στην εκπομπή ""Αυτοψία"" με τον Αντώνη Σρόιτερ",#live
"Συνέντευξη στον Alpha και στην εκπομπή ""Αυτοψία"" με τον Αντώνη Σρόιτερ",#live
Δήλωση στα Τέμπη,
"Στόχος της κυβέρνησης Μητσοτάκη ήταν εξαρχής η συγκάλυψη του παρακράτους, που η ίδια δημιούργησε.",
