Title,Description
Παρέμβαση στην επιτροπή PEGA,"Στόχος της κυβέρνησης Μητσοτάκη ήταν εξαρχής η συγκάλυψη του παρακράτους, που η ίδια δημιούργησε.

Σε οποιαδήποτε ευρωπαϊκή χώρα που λειτουργεί εύρυθμα το κράτος δικαίου, θα είχαν κληθεί να λογοδοτήσουν στη Δικαιοσύνη ο κ. Δημητριάδης, ο ανιψιός του Πρωθυπουργού, η εισαγγελέας κυρία Βλάχου και ο τότε διοικητής της ΕΥΠ ο κ. Κοντολέων. Είναι προφανές ότι μετά από αυτή την κατάφωρη παραβίαση των ανθρωπίνων δικαιωμάτων και του Συντάγματος, δεν θα μπορούσε να σταθεί ούτε ο κ. Μητσοτάκης ως Πρωθυπουργός.

Αντ’ αυτού, όμως, αυτό που ζούμε, είναι η απίστευτη αντίδραση μιας καθεστωτικής φιλοσοφίας. Αντί, λοιπόν, να αποκαλυφθούν οι ένοχοι και να οδηγηθούν στη Δικαιοσύνη, τα θύματα και οι άτεγκτοι δικαστές που προσπαθούν να βρουν και να δώσουν στη δημοσιότητα το τι έχει συμβεί σε αυτή την υπόθεση, γίνονται στόχοι ηθικής απαξίωσης και πολιτικής εξόντωσης. 

Ο κ. Ράμμος στοχοποιήθηκε όλο το προηγούμενο διάστημα από συγκεκριμένα μέσα και υπουργούς της Κυβέρνησης, γιατί κάνει τη δουλειά του. Είπε ότι έχει βρεθεί ο λογαριασμός που πλήρωσε το μήνυμα και δόθηκαν στη Δικαιοσύνη τα στοιχεία για την αποστολή του μηνύματος παγίδευσης στο κινητό μου. Πότε δόθηκαν αυτά τα στοιχεία στη Δικαιοσύνη; Για να δούμε και τους ρυθμούς που κινείται η ελληνική Δικαιοσύνη. Διότι πρέπει επιτέλους μετά από οκτώ μήνες να αξιολογήσουμε και αυτό. Δεν πρέπει, από τη στιγμή που έχουν δοθεί αυτά τα στοιχεία, να μάθουμε ποιος είναι ο κάτοχος του λογαριασμού που έστελνε όλα αυτά τα μηνύματα, προσπαθώντας να εγκλωβίσει ανθρώπους με αυτό το κατασκοπευτικό υπερόπλο που λειτουργούσε στη χώρα μας, το Predator;"
Ομιλία στη Δράμα,#live
Συνάντηση με ομοσπονδίες τριτέκνων,"Συνάντηση με την Ομοσπονδία Πολυμελών Οικογενειών Τριών Τέκνων Ελλάδας (Ο.Π.Ο.Τ.Τ.Ε.) και την Παγκύπρια Οργάνωση Πολυμελούς Οικογένειας (Π.Ο.Π.Ο.) είχε νωρίτερα στη Βουλή ο Νίκος Ανδρουλάκης.

Ο Πρόεδρος του ΠΑΣΟΚ-Κινήματος Αλλαγής επισήμανε την προτεραιότητα που αποδίδει στην αντιμετώπιση του δημογραφικού.

«Έχουν αυξηθεί οι ανισότητες και το κόστος ζωής. Έχουμε χρέος να στηρίξουμε τους τρίτεκνους, αλλά και τις πολύτεκνες οικογένειες. Αυτό πρέπει να γίνει με φορολογικά κίνητρα αλλά και με ένα πρόγραμμα κοινωνικών κατοικιών στα πρότυπα άλλων ευρωπαϊκών χωρών» ανέφερε ο κ. Ανδρουλάκης παρουσιάζοντας την πρόταση του ΠΑΣΟΚ-Κινήματος Αλλαγής για την κοινωνική στέγη. Κύρια φιλοσοφία του αποτελεί η κατασκευή νέων κατοικιών αλλά και η παροχή κινήτρων ανακατασκευής σε ιδιώτες προκειμένου να εντάξουν τα ακίνητά τους σε μεγάλες δεξαμενές κοινωνικών κατοικιών. Έτσι, θα μειωθεί το κόστος στέγασης για πολύτεκνους, τρίτεκνους, νέα ζευγάρια και φοιτητές.

«Συμφωνούμε με την πολιτική οι τρίτεκνοι να αποκτούν τα δικαιώματα των πολύτεκνων χωρίς να θίγονται όσοι έχουν ήδη την πολυτεκνική ιδιότητα και επίσης θεωρούμε ότι είναι πάρα πολύ ουσιαστικό να στηρίξουμε και να καθιερώσουμε τον Εθνικό Αποταμιευτικό Λογαριασμό για κάθε παιδί ο οποίος θα χρηματοδοτείται από την πολιτεία και τον γονέα» σημείωσε ο κ. Ανδρουλάκης.

«Αυτές οι προτεραιότητες θα συμβάλουν στη βελτίωση των δημογραφικών στοιχείων. Αν αυτό δεν συμβεί άμεσα, δυστυχώς θα έχουμε ένα εθνικό και παράλληλα οικονομικό πλήγμα.Η χώρα θα γερνάει και θα λιγοστεύει το ανθρώπινο δυναμικό, που θα μπορεί να σηκώσει στις πλάτες του την ανάπτυξη της πατρίδας μας»τόνισε χαρακτηριστικά ο Πρόεδρος του ΠΑΣΟΚ-Κινήματος Αλλαγής.

Οι εκπρόσωποι των τριτέκνων από την πλευρά τους έθεσαν μεταξύ άλλων το ζήτημα της πλήρους εξομοίωσης με τους πολύτεκνους, τη στεγαστική συνδρομή με χαμηλότοκα δάνεια στα πρότυπα της Πορτογαλίας και τη στήριξη της εργαζόμενης μητέρας με ενισχυμένα κριτήρια και μοριοδότηση.

Στη συνάντηση συμμετείχαν,επίσης, ο βουλευτής και υπεύθυνος του κοινοβουλευτικού τομέα Εργασίας και Κοινωνικών Ασφαλίσεων, Γιώργος Μουλκιώτης, η Κοινοβουλευτική Εκπρόσωπος Νάντια Γιαννακοπούλου και η Γραμματέας του Τομέα Πρόνοιας και Κοινωνικής Συνοχής, Έφη Μπέκου."
Συνέντευξη στο Action24,#live
Κάποιοι δεν θέλουν να αντιμετωπίσουν το τέρας αλλά να το μιμηθούν #pasok,
Ομιλία στην Χαλκίδα,#live
