Title,Description
Σχέδιο εκποίησης των ακινήτων ευνοώντας τα μεγάλα συμφέροντα,"Πιστεύουμε ότι αντί η κυβέρνηση να επιτρέπει στις επενδυτικές εταιρίες, να συνεχίσουν να κερδοσκοπούν σε βάρος των δανειοληπτών ενώ οι ίδιες αγόρασαν τα κόκκινα δάνεια στο 1/5 της αξίας τους, θα πρέπει να θεσπίσει διατάξεις που θα επιτρέπουν στις τράπεζες, πριν την τιτλοποίηση και την πώληση των κόκκινων δανείων, να προηγείται μία ουσιαστική διαπραγμάτευση, για τον καθορισμό νέων όρων αποπληρωμής, κουρέματος ή επαναγοράς των δανείων από τους δανειολήπτες.

Η εισήγηση του Ανδρέα Βορύλλα, βουλευτή Β2 Δυτικού Τομέα Αθηνών της ΝΙΚΗΣ, στη Διαρκή Επιτροπή Οικονομικών Υποθέσεων (27/11/2023)."
Προωθούνται ύπουλα οι «οικογένειες» ομοφυλοφίλων στα σχολεία!,"Δημιουργείται πλήρης σύγχυση πάνω στην ταυτότητα του φύλου που συνδέεται με αυξημένα ποσοστά κατάθλιψης, αυτοκτονιών και άλλων ψυχικών νοσημάτων.
Υπάρχει διαφωνία και σκεπτικισμός εντός της εκπαιδευτικής κοινότητας και εντός της κοινωνίας. Δεν πρόκειται για τη φυσική και τα μαθηματικά ούτε καν για τη βιολογία και τις λειτουργίες του ανθρώπινου σώματος. Πρόκειται για εκπαιδευτική ύλη που είναι σε σύγκρουση με τις φιλοσοφικές και θρησκευτικές πεποιθήσεις πολλών γονέων, ίσως της πλειοψηφίας των Ελλήνων γονέων, εάν γνώριζαν τι πραγματικά διδάσκονται τα παιδιά τους.
Διαπιστώνουμε μια εμμονική προσήλωση της Κυβέρνησης σε μια ατζέντα αποδόμησης των αξιών και των ταυτοτήτων πάνω στις οποίες στερεώθηκε η ελληνική κοινωνία.
Σας καλούμε να σεβαστείτε τα διεθνή θεσμικά κείμενα για το δικαίωμα των Ελλήνων γονέων που επιθυμούν διαφορετική, πνευματική τροφή για τα παιδιά τους, δίνοντας τους τη δυνατότητα εξαίρεσης και εναλλακτικής επιλογής από το πρόγραμμα της σεξουαλικής διαπαιδαγώγησης."
«Δεν εμπιστευόμαστε τη μυστική διπλωματία Μητσοτάκη - Ερντογάν!» - Δημήτρης Νατσιός,"Ο πρωθυπουργός να σεβαστεί το Σύνταγμα και τον Ελληνικό λαό  και να συγκαλέσει το συνταγματικά προβλεπόμενο Εθνικό Συμβούλιο Εξωτερικής Πολιτικής, για να ενημερώσει έγκαιρα την Εθνική Αντιπροσωπεία για τις προθέσεις της, πριν τις συνομιλίες με τον κ. Ερντογάν στις 7 Δεκεμβρίου.

Από ομιλία του Δημήτρη Νατσιού, προέδρου της ΝΙΚΗΣ, στην Ολομέλεια της Βουλής (22/11/2023)."
Τέμπη: Η ευρωπαϊκή εισαγγελία εντοπίζει βαριές ευθύνες και δόλο,"Άρχισε στην χώρα μας να ξετυλίγεται το  κουβάρι της διαπλοκής .Εμείς στη ΝΙΚΗ δεν θα πάψουμε να αναζητούμε ευθύνες όσο ψηλά κι αν βρίσκονται. Το οφείλουμε στις οικογένειες που ξαφνικά έχασαν ένα ή περισσότερα μέλη τους και καλούνται να επουλώσουν τις βαθιές πληγές τους  εναποθέτοντας την ελπίδα για ίαση της ψυχής τους στο Θεό και στο κράτος δικαίου που τους έταξε παρηγοριά.
Πόσοι από μας αισθανθήκαμε ντροπή όταν διαβάσαμε ότι την πρωτοβουλία για την υπόθεση αυτή δεν την έχει ελληνική δικαιοσύνη αλλά η Ευρωπαία εντεταλμένη εισαγγελέας που υποχρέωσε τον εισαγγελέα του Αρείου πάγου  να ανακαλέσει από την αρχείο τη σχετική δικογραφία.
Η ευρωπαϊκή εισαγγελία εντοπίζει βαριές ευθύνες στα στελέχη της ΕΡΓΟΣΕ και της κοινοπραξίας αποδίδοντάς τους δόλο. Περιμένει από εμάς να αποδώσουμε δικαιοσύνη αλλιώς μας επιφυλάσσει συνέπειες.
Ζούμε ακόμα στην εποχή που οι ευρωπαίοι μας δίνουν χρήματα και να τα σπαταλάμε; Δεν βάλαμε μυαλό από τα μνημόνια και την καταστροφή της οικονομίας μας;  Αν δεν έχετε ευθύνη κύριοι υπουργοί ζητήστε μόνοι σας να λάμψει η αλήθεια παραιτούμενοι της ασυλίας. 

Ομιλία του Τάσου Οικονομόπουλου, βουλευτή Α΄ Ανατολικής Αττικής της ΝΙΚΗΣ στην ολομέλεια της Βουλής με θέμα ""Συζήτηση και λήψη απόφασης για την σύσταση Ειδικής Επιτροπής προς διενέργεια προκαταρκτικής εξέτασης για ενδεχόμενα αδικήματα στη σύμβαση Ανάταξης και Αναβάθμισης του συστήματος Σηματοδότησης - Τηλεδιοίκησης του άξονα Αθήνα - Θεσσαλονίκη - Προμαχώνας"" (24/11/2023)."
"Η ΝΙΚΗ δεν θα ""τσιμεντώσει"" τις φωνές των Τεμπών, το αίμα των νεκρών ζητά δικαίωση!","Η ΝΙΚΗ σκοπεύει  να καταδείξει το πραγματικό έγκλημα των Τεμπών και θα μιλήσει όχι μόνο για τις οικονομικές παραμέτρους, αλλά για αυτό καθ' αυτό το σιδηροδρομικό δυστύχημα στα Τέμπη  μιας επιβατικής αμαξοστοιχίας  με μία εμπορική, το δρομολόγιο και το φορτίο της οποίας ακόμη παραμένουν μυστήριο.
Ο πρωθυπουργός και όλη η κυβέρνηση ψηφίζουν δήθεν πρόθυμα την πρόταση του ΚΚΕ για τη σύσταση εξεταστικής επιτροπής αλλά συνάμα προωθεί το κουκούλωμα και την ατιμωρησία των υπευθύνων.
Σκοτώνει 57 ανθρώπους και την επομένη πιάνει δουλειά για να εξαφανίσει τα στοιχεία να κουκουλώσει την υπόθεση.
Η εντολή για το τσιμέντωμα στον τόπο του δυστυχήματος ήρθε από πολύ ψηλά .
Να μην ακούμε Τέμπη και ο νους μας θα πηγαίνει μόνο σε δυστυχήματα, μα να ακούμε Τέμπη και να μιλάμε για ένα θρίαμβο της δικαιοσύνης.

Ομιλία του Δημήτρη Νατσιού, προέδρου της ΝΙΚΗΣ, στην ολομέλεια της Βουλής με θέμα ""Συζήτηση και λήψη απόφασης για την σύσταση Ειδικής Επιτροπής προς διενέργεια προκαταρκτικής εξέτασης για ενδεχόμενα αδικήματα στη σύμβαση Ανάταξης και Αναβάθμισης του συστήματος Σηματοδότησης - Τηλεδιοίκησης του άξονα Αθήνα - Θεσσαλονίκη - Προμαχώνας"" (24/11/2023)."
Έγκλημα Τεμπών: Μεθοδική συγκάλυψη της αλήθειας!,"Το έγκλημα των Τεμπών το ανακίνησε η Ευρωπαϊκή Δικαιοσύνη. Την διερεύνηση στον τόπο του εγκλήματος την ανέλαβε ιδιωτική εταιρεία. Καμία ελληνική αρχή δεν έσπευσε στην περισυλλογή στοιχείων. Πού είναι το ελληνικό κράτος; 
Το μόνο που έκανε ήταν να μπαζώσει εσπευσμένα τον περιβάλλοντα χώρο. 
Γίνεται μεθοδικά η συγκάλυψη των γεγονότων, η απόκρυψη της αλήθειας και από την άλλη μεριά επιχειρείται μια προσπάθεια να πεισθεί η ελληνική κοινωνία ότι λειτουργούσε η τηλεδιοίκηση.
Οι προκλητικές δηλώσεις υπουργών αποδεικνύουν πόσο βαθιά νυχτωμένοι και επικίνδυνοι είναι όσοι έχουν περάσει από την ηγεσία της χώρας. Η ψηφιοποίηση χρησιμοποιείται όχι για την προστασία των πολιτών αλλά μόνο για τον έλεγχο και την προσβολή της ιδιωτικότητας.


Ομιλία του Σπύρου Τσιρώνη, βουλευτή Αχαΐας της ΝΙΚΗΣ στην ολομέλεια της Βουλής με θέμα "" Συζήτηση και λήψη απόφασης για την σύσταση Ειδικής Επιτροπής προς διενέργεια προκαταρκτικής εξέτασης για ενδεχόμενα αδικήματα στη σύμβαση Ανάταξης και Αναβάθμισης του συστήματος Σηματοδότησης - Τηλεδιοίκησης του άξονα Αθήνα - Θεσσαλονίκη - Προμαχώνας"" (24/11/2023)."
ΤΕΜΠΗ: Ποινικές ευθύνες σε κάθε πολιτικό πρόσωπο όσο υψηλά κι αν βρίσκεται,"Η ΝΙΚΗ έχει δεσμευθεί να αξιοποιήσει όλα τα κοινοβουλευτικά μέσα προκειμένου να αποδοθούν οι ποινικές ευθύνες σε κάθε πολιτικό πρόσωπο όσο ψηλά κι αν βρίσκεται.
Είναι χρέος ιερό απέναντι στον ελληνικό λαό  και στους χαροκαμένους συγγενείς των αδικοχαμένων θυμάτων.
Υπήρξε εγκληματική κακοδιαχείριση  στα χρηματοδοτούμενα προγράμματα για την τοποθέτηση και εγκατάσταση συστημάτων τηλεδιοίκησης και τηλεδιαχείρισης.
Η κυβέρνηση της Νέας Δημοκρατίας  έκανε τα πάντα για την αποποίηση των ευθυνών καταστρέφοντας όλα τα κρίσιμα αποδεικτικά στοιχεία επί του πεδίου του δυστυχήματος. Οι προκλητικές δηλώσεις τόσο του κ. Καραμανλή πριν, όσο και του κ. Γεωργιάδη μετά το έγκλημα των Τεμπών, μαρτυρούν την αλαζονική στάση της κυβέρνησης και την έλλειψη διάθεσης για αυτοκάθαρση.

Ομιλία του κ. Νικολάου Βρεττού, βουλευτή Β3 Νοτίου Τομέα Αθηνών της ΝΙΚΗΣ στην ολομέλεια της Βουλής, με θέμα ""Συζήτηση και λήψη απόφασης για την σύσταση Ειδικής Επιτροπής προς διενέργεια προκαταρκτικής εξέτασης για ενδεχόμενα αδικήματα στη σύμβαση Ανάταξης και Αναβάθμισης του συστήματος Σηματοδότησης - Τηλεδιοίκησης του άξονα Αθήνα - Θεσσαλονίκη - Προμαχώνας"" (24/11/2023)."
Kρατικός προϋπολογισμός 2024: Υποθηκεύει το μέλλον των παιδιών μας!,"Μέριμνα της κυβέρνησης είναι η εφαρμογή των ευρωπαϊκών δεσμεύσεων και όχι η ενίσχυση του παραγωγικού δυναμικού της χώρας.
Το 2024 η Ευρωζώνη θα προχωρήσει σε πιο αυστηρή δημοσιονομική πολιτική και στην σταδιακή κατάργηση των μέτρων ενεργειακής στήριξης.
Στην χώρα μας κυριαρχούν η αισχροκέρδεια, οι πλειστηριασμοί, το ξεπούλημα της δημόσιας περιουσίας και φυσικά ο προϋπολογισμός δεν μπορεί να δώσει λύση στο δυσθεώρητο δημόσιο χρέος. Απαιτείται δραστική επέμβαση του κράτους για την παύση της αισχροκέρδειας.
Τα παιδιά μας παίρνουν τον δρόμο της ξενιτιάς αναζητώντας αξιοπρεπή εργασία και κάποια επηρεασμένα από την ακραία φτώχεια έχουν αγριέψει εμφανίζοντας παραβατική συμπεριφορά.

Ομιλία του Δημήτρη Νατσιού, προέδρου της ΝΙΚΗΣ, για τον Κρατικό Προϋπολογισμό 2024, στη Διαρκή Επιτροπή Οικονομικών Υποθέσεων (23/11/2023)."
Ο παραγόμενος πλούτος πρέπει να διοχετεύεται στους πολίτες και στις ανάγκες τους,"Αιχμή του δόρατος στον προυπολογισμό, θα έπρεπε να είναι η στήριξη του πρωτογενή τομέα της γεωργίας, κτηνοτροφίας, αλιείας, διαχείρισης δασών και εξόρυξης μεταλλευμάτων.
Στα μέτρα στήριξης απουσιάζει οποιαδήποτε πολιτική προστασίας από την άνοδο των επιτοκίων για νοικοκυριά και επιχειρήσεις.

Η εισήγηση του Ανδρέα Βορύλλα, βουλευτή Β2 Δυτικού Τομέα Αθηνών, για τον Κρατικό Προϋπολογισμό 2024, στη Διαρκή Επιτροπή Οικονομικών Υποθέσεων (23/11/2023)."
Έρχεται δραματική μείωση στην παροχή οικονομικών ενισχύσεων,"Ομιλία του Ανδρέα Βορύλλα, βουλευτή Β2 Δυτικού Τομέα Αθηνών της ΝΙΚΗΣ, στην Ειδική Διαρκή Επιτροπή Ευρωπαϊκών Υποθέσεων και Διαρκή Επιτροπή Οικονομικών Υποθέσεων, με θέμα «Παρουσίαση των ετήσιων Εκθέσεων του Ευρωπαϊκού Ελεγκτικού Συνεδρίου για το οικονομικό έτος 2022» (22.11.2023)."
Κομματοκρατία και αγαπημένες κατασκευαστικές υπονομεύουν την ασφάλεια των πολιτών,"Δευτερολογία του Δημήτρη Νατσιού, προέδρου της ΝΙΚΗΣ , στην Ολομέλεια της Βουλής, στην ενημέρωση με αντικείμενο την ενημέρωση του Σώματος για την υλοποίηση των πρωτοβουλιών της Κυβέρνησης σχετικά με την ανασυγκρότηση των περιοχών της Θεσσαλίας και του Έβρου και την αντιμετώπιση της κλιματικής κρίσης (22/11/2023)."
Παραλήρημα Καιρίδη ακούγοντας τις πατριωτικές θέσεις της ΝΙΚΗΣ,"Τι κι αν η Τουρκία, με το δόγμα της «γαλάζιας πατρίδας», έχει στόχο τον έλεγχο του μισού Αιγαίου; Η ελληνική κυβέρνηση υποκύπτει σε κάθε εκβιασμό της,  επιτρέποντας τις  ελεύθερες επισκέψεις Τούρκων πολιτών στα νησιά Ρόδο, Λέσβο, Σάμο, Χίο, Κω, Λέρο και Καστελόριζο και το ίδιο σχεδιάζει να κάνει και στον Έβρο.
Μήπως ο τουρισμός υπερτερεί της εθνικής ασφάλειας;
Έχει πάρει την σύμφωνη γνώμη του Υπουργείου Εθνικής Άμυνας σε ότι αφορά την εκτίμηση των κινδύνων ασφάλειας και Άμυνας;
Προχωρά  μάλιστα σε διάλογο με την Τουρκία που σύμφωνα με τα λεγόμενα του πρωθυπουργού, αυτό ίσως σημαίνει και κάποιες «υποχωρήσεις» και απομείωση της εθνικής μας κυριαρχίας.
Οι Έλληνες δεν είμαστε «παιδιά Οθωμανών» όπως προκλητικά είχε δηλώσει ο κ. Καιρίδης αλλά θύματα γενοκτονιών από τους Τούρκους.
Για εμάς τα Σκόπια παραμένουν Σκόπια και στις Πρέσπες υπήρξε προδοσία!
 
Επίκαιρη ερώτηση του προέδρου της ΝΙΚΗΣ και  βουλευτή Α΄ Θεσσαλονίκης Δημήτρη Νατσιού προς τον Υπουργό Μετανάστευσης και Ασύλου με θέμα «Κατάργηση υποχρέωσης βίζας για Τούρκους πολίτες». Απαντά ο Υπουργός κ. Δημήτρης Καιρίδης (22-11-2023)."
"Ο Έβρος καταρρέει, στη Θεσσαλία άστεγοι και ανέστιοι και στο Μαξίμου χαμόγελα","Τρείς μήνες μετά το χτύπημα της φονικής κακοκαιρίας Ντάνιελ οι κάτοικοι της Θεσσαλίας παραμένουν ανέστιοι και άστεγοι έχοντας ουσιαστικά εξαπατηθεί από την κομματοκρατούμενη αυτοδιοίκηση και τις εξαγγελίες της.

Μετά από μόνιμη κρατική αδιαφορία, υβριδικές απειλές της Τουρκίας, λαθρομετανάστευση, μαφία διακινητών, κλοπές και λεηλασίες , οι ακρίτες του Έβρου αντιμέτωποι και με το τεράστιο πλήγμα των 900.000 στρεμμάτων καμένου δάσους.
Ο Έβρος μας κάηκε και παράλληλα το έθνος από το ολοκαύτωμα του δημογραφικού, αφού αναμένεται να μετατραπεί σε έρημη γη χωρίς ελληνική παρουσία, καθώς βάση μελέτης αναμένεται πληθυσμιακή αποψίλωση των Ελλήνων στην περιοχή. Τα στοιχεία σοκάρουν.
Τι κάνει η κυβέρνηση για την πληθυσμιακή ανάκαμψη; Κανένα κίνητρο σε νέα ζευγάρια, καμία υποδομή για θέσεις εργασίας, η οικονομία του Έβρου παραπαίει. Ελπίδα μας να αναστηθούμε από τη λίγη μαγιά του Ελληνισμού.

Η ομιλία του Δημήτρη Νατσιού, προέδρου της ΝΙΚΗΣ , στην Ολομέλεια της Βουλής, στην ενημέρωση με αντικείμενο την ενημέρωση του Σώματος για την υλοποίηση των πρωτοβουλιών της Κυβέρνησης σχετικά με την ανασυγκρότηση των περιοχών της Θεσσαλίας και του Έβρου και την αντιμετώπιση της κλιματικής κρίσης (22/11/2023)."
Παράνομοι μετανάστες από τα 4 σημεία του ορίζοντα έρχονται στην Ελλάδα,"Μετά την  συμφωνία Ιταλίας και Αλβανίας ώστε να δεχτεί η Αλβανία μεταναστευτικές ροές  στο έδαφός της κινδυνεύουμε από τα 4 σημεία του ορίζοντα να εισέλθουν στην χώρα μας  παράνομοι μετανάστες. Τι  μέτρα πρόκειται να λάβει η Ελλάδα ως χώρα της πρώτης γραμμής;
Πολλοί από αυτούς αποτελούν αιτία της αύξησης της  εγκληματικότητας, των βιασμών και πολλών πυρκαγιών, διότι δεν αγαπάνε την πατρίδα μας και δεν πρόκειται ποτέ να ενσωματωθούν στον πολιτισμό μας.
Μετά το BREXIT διαπιστώνουμε ότι πολλές χώρες κινούνται προς την έξοδο και το όραμα μιας ενωμένης πολιτισμικά Ευρώπης βρίσκεται  κάτω από συνεχή απειλή. 

Επίκαιρη ερώτηση του Τάσου Οικονομόπουλου, βουλευτή Α΄ Ανατολικής Αττικής της ΝΙΚΗΣ, προς τον Υπουργό Μετανάστευσης και Ασύλου με θέμα: «Ανησυχία για πιθανές επιπτώσεις εις βάρος μας μετά την υπογραφή του πρόσφατου πρωτοκόλλου συνεργασίας για το μεταναστευτικό μεταξύ Ιταλίας και Αλβανίας». Απαντά ο Υπουργός Δ. Καιρίδης (22/11/2023)."
21 Νοεμβρίου 1940: η αρχή της τριπλής «απάντησης» για την προσβολή προς την Θεοτόκο,"21 Νοεμβρίου, ημέρα Εισοδίων της Θεοτόκου και ημέρα των Ενόπλων Δυνάμεων, είναι και η μνήμη της πρώτης απελευθέρωσης Βορειοηπειρωτικής γης, της Κορυτσάς, στην ελληνική αντεπίθεση του ένδοξου 1940.
Πρόκειται για το «πρώτο μέρος» μίας τριπλής απάντησης που δέχθηκαν οι Ιταλοί, για την προσβολή προς την Θεοτόκο μας κατά την εορτή της Κοιμήσεώς της με το ύπουλο δολοφονικό χτύπημα στην Τήνο.
Πράγματι, η ιστορία καταγράφει με εντυπωσιακό τρόπο τριπλή «απάντηση» στην προσβολή, μέσα από άλλες τρεις Θεομητορικές εορτές:
- 21η Νοεμβρίου 1940, Εισόδια της Θεοτόκου: Η πρώτη νίκη και απελευθέρωση ελληνικής πόλης της Βορείου Ηπείρου, της Κορυτσάς.
- 25η Μαρτίου 1941, Ευαγγελισμός της Θεοτόκου: Η λήξη, με πλήρη αποτυχία, της τελευταίας εαρινής επίθεσης των Ιταλών.
- 8η Σεπτεμβρίου 1943, Γενέσιο της Θεοτόκου: Η οριστική κατάρρευση και παράδοση άνευ όρων της Ιταλίας στους συμμάχους.

Αφιερώνουμε αυτό το μικρό βίντεο στους απογόνους των ηρώων του ’40, στον σημερινό ελληνικό λαό, θυμίζοντας την Ανίκητη Ψυχή του, που κάνει θαύματα όταν πορεύεται με φιλότιμο, πίστη και πνεύμα αυτοθυσίας."
