Title,Description
"Κοινοβουλευτικό Έργο Ανδρέα Βορύλλα, μέλους της Διαρκούς Επιτροπής Οικονομικών Υποθέσεων της Βουλής","Αποσπάσματα ομιλιών του Ανδρέα Βορύλλα, μέλους της Διαρκούς Επιτροπής Οικονομικών Υποθέσεων της Βουλής και βουλευτή Β2 Δυτικού Τομέα Αθηνών της ΝΙΚΗΣ, μεταξύ άλλων για ΤΑΙΠΕΔ, Κόκκινα Δάνεια, Πληθωρισμό, Φορολογία Ελεύθερων Επαγγελματιών, Δημόσιο Χρέος, Υπογεννητικότητα και ίδρυση Γεωργικού και Κτηνοτροφικού Πανεπιστημίου στην Θεσσαλία."
"""Όλα τα έργα έχουν φαγοπότι"": Η επιτομή της κομματοκρατίας στην Εξεταστική για τα ΤΕΜΠΗ","""Όλα τα έργα έχουν φαγοπότι"".
Αυτή είναι η επιτομή της κομματοκρατίας, σε μία φράση μάρτυρα της Εξεταστικής Επιτροπής για τα ΤΕΜΠΗ, τον οποίο πρότεινε η ΝΔ, απαντώντας σε ερώτηση του βουλευτή της ΝΙΚΗΣ κ. Τάσου Οικονομόπουλου.


Εδώ παρακολουθήστε όλο το βίντεο με τις ερωτήσεις του κ. Τάσου Οικονομόπουλου στην Εξεταστική Επιτροπή στις 18.12.2023:
https://www.youtube.com/watch?v=gMHPI-gjhes&t=5s"
Τέμπη: Η ΝΙΚΗ ξεκίνησε να ξετυλίγει το κουβάρι της διαφθοράς!,"ΟΣΕ και ΕΡΓΟΣΕ είναι συνυπεύθυνοι για την εγκληματική έλλειψη συντήρησης στο σύστημα τηλεδιοίκησης!

Τα ερωτήματα είναι αμείλικτα και γυρεύουν απάντηση: 
Σε ποιες τεχνικές ασφαλείας στηρίχτηκε η Διοίκηση του ΟΣΕ για να επιτραπεί να κατεβάσει τους χρόνους κατά 2 ώρες στη διαδρομής Αθήνα – Θεσσαλονίκη; 
Στο δυστύχημα των Τεμπών ήταν επαρκής ο αριθμός εργαζομένων ώστε να τηρηθεί ο κανονισμός ασφαλείας;
Φταίει μόνο ο σταθμάρχης ή φταίνε και αυτοί που δεν φρόντισαν για την σωστή στελέχωση του προσωπικού;
Τι προδιαγραφές είχε το σύστημα παρακολούθησης στο χώρο του δυστυχήματος, ποιος το συντηρούσε και γιατί δεν λειτουργούσε;

Ερωτήσεις του Τάσου Οικονομόπουλου, βουλευτή Α΄ Ανατολικής Αττικής της ΝΙΚΗΣ, στην Εξεταστική Επιτροπή για την «Διερεύνηση του εγκλήματος των Τεμπών και όλων των πτυχών που σχετίζονται με αυτό». Απαντούν οι Κωνσταντίνος Γιαννακός, Διευθύνων Σύμβουλος ΟΣΕ 2001-2005 και Χρήστος Τσίτουρας, Διευθύνων Σύμβουλος και Γενικός Δ/ντης ΕΡΓΟΣΕ 1996-2004 (18.12.2023)."
"Προκλητικές αυξήσεις σε εξωκοινοβουλευτικούς υπουργούς, πενιχρές οι απολαβές των ιατρών","Με αφορμή το περιστατικό του σοβαρού τραυματισμού του αστυνομικού στο γήπεδο του Ρέντη και του θανάτου του αστυνομικού στον Ασπρόπυργο είναι ανάγκη να δοθεί προσοχή στις σημαντικές ελλείψεις στο ΕΣΥ. 
Συμβαίνει το παράδοξο να δίνονται κίνητρα σε ηλικιωμένους γιατρούς για να παρατείνουν την παραμονή τους στην εργασία τους αντί να δοθούν κίνητρα στους νέους ιατρούς να εργαστούν στον τόπο τους. 
Είναι πενιχρές οι απολαβές των υγειονομικών σε αντίθεση με την προκλητική αύξηση των απολαβών των εξωκοινοβουλευτικών υπουργών και υφυπουργών. Η πολιτεία οφείλει να αποδώσει στους μαχόμενους ιατρούς σταθερό εργασιακό περιβάλλον και ευπρεπείς αποδοχές. 

Ομιλία του Ανδρέα Βορύλλα, βουλευτή Β2 Δυτικού Τομέα Αθηνών της ΝΙΚΗΣ, στην Ολομέλεια της Βουλής για το σχέδιο νόμου του Υπουργείου Εθνικής Οικονομίας και Οικονομικών «Οργανωτικές και διαδικαστικές διατάξεις για την ανάπτυξη, παρεμβάσεις για την ενίσχυση της δίκαιης αναπτυξιακής μετάβασης και άλλες επείγουσες διατάξεις» (19/12/2023)."
Σας ενδιαφέρει η ατζέντα του Νταβός και όχι ο λαός!,"Αποσύρθηκε από το Ελληνικό Γενικό Προξενείο της Νέας Υόρκης το κουρελούργημα το οποίο διακωμωδούσε την ελληνική σημαία. Είναι μία μικρή νίκη εναντίον της αφιλοπατρίας και του αφελληνισμού.
Προωθείτε δουλειές, που θα αναγκάσουν τον Έλληνα να τσακίζει τη μέση του υπηρετώντας τους καλοζωισμένους συνταξιούχους του ευρωπαϊκού βορρά οι οποίοι μέσω κάποιον funds θα έχουν αγοράσει την περιουσία του ελληνικού λαού.
Ευτυχώς υπάρχει η ΝΙΚΗ που εκφράζει τη Ρωμιοσύνη, που υπηρετεί τον ελληνικό λαό και θα σταματήσει την δημογραφική κατάρρευση του έθνους μας, με τη γέννηση Ελλήνων και την επαναφορά τον ξεριζωμένων από το εξωτερικό και όχι με την αθρόα προσέλευση παράνομων μεταναστών.

Ομιλία του Δημήτρη Νατσιού, προέδρου της ΝΙΚΗΣ, στην Ολομέλεια της Βουλής για το σχέδιο νόμου του Υπουργείου Εργασίας και Κοινωνικής Ασφάλισης «Αναμόρφωση επαγγελματικής ασφάλισης, εξορθολογισμός ασφαλιστικής νομοθεσίας, συνταξιοδοτικές ρυθμίσεις, σύστημα διορισμού και προσλήψεων των εκπαιδευτικών της δημόσιας υπηρεσίας απασχόλησης και λοιπές διατάξεις» (19/12/2023)."
Απαιτείται πολιτική βούληση και αναζήτηση των αιτιών για την εξάλειψη της οπαδικής βίας,"Καταγράφονται συνεχώς περιστατικά οπαδικής βίας σε κάθε γωνιά της πατρίδας μας και ιδιαίτερα στα αστικά κέντρα. Απαιτείται πολιτική βούληση για να εξαλειφθούν αυτά τα θλιβερά φαινόμενα ώστε να μην θρηνήσουμε άλλα θύματα. 
Η ΝΙΚΗ προτείνει να μη βλέπουμε το θέμα μεμονωμένα αλλά να δούμε τι οδηγεί τους νέους και τις νέες σε δολοφονικές επιθέσεις. Μήπως η ακραία φτώχεια επέτρεψε να γίνουν θύματα επιτηδείων  οι οποίοι έχουν αναγάγει την αθλητική βία σε επάγγελμα και βιοποριστικό μέσο; Τι παράδειγμα τους δίνουμε εμείς εδώ στο κοινοβούλιο με τον τρόπο που μιλάμε και τσακωνόμαστε;

Ομιλία του Ανδρέα Βορύλλα, βουλευτή Β2 Δυτικού Τομέα Αθηνών της ΝΙΚΗΣ, στην επιτροπή οικονομικών υποθέσεων για το Σ/Ν του Υπουργείου Εθνικής Οικονομίας και Οικονομικών: ""Οργανωτικές και διαδικαστικές διατάξεις για την ανάπτυξη, παρεμβάσεις για την ενίσχυση της δίκαιης αναπτυξιακής μετάβασης και άλλες επείγουσες διατάξεις"" (18.12.2023)."
Κλείσιμο του ματιού στην ιδιωτική ασφάλιση,"Το παρόν ασφαλιστικό νομοσχέδιο δεν λύνει βασικά προβλήματα των εργαζομένων και κλείνει το μάτι στην ιδιωτική ασφάλιση. 
Υψηλοί συντελεστές φορολόγησης απειλούν τα ταμεία οδηγώντας τα σε κατάρρευση.
Οι νέοι ωθούνται στην μετανάστευση και οι ηλικιωμένοι που κοντεύουν να συνταξιοδοτηθούν, σε παράταση της εργασίας.
Παράλληλα θεσπίζεται η άνευ όρων νομιμοποίηση των λαθρομεταναστών και η χώρα μας καθίσταται ως η πιο ελκυστική στην παράνομη μετανάστευση .

Ομιλία του Κομνηνού Δελβερούδη, βουλευτή Πιερίας της ΝΙΚΗΣ, για το νομοσχέδιο του Υπουργείου Εργασίας και Κοινωνικής Ασφάλισης με τίτλο «Αναμόρφωση επαγγελματικής ασφάλισης, εξορθολογισμός ασφαλιστικής νομοθεσίας, συνταξιοδοτικές ρυθμίσεις, σύστημα διορισμού και προσλήψεων των εκπαιδευτικών της δημόσιας υπηρεσίας απασχόλησης και λοιπές διατάξεις» (18.22.23)."
Καμία συναίνεση στην τροπολογία για το μεταναστευτικό,"Η κυβέρνηση μας μιλά για άρση των αδικιών στο ασφαλιστικό αλλά δυστυχώς με την πολιτική της πάντα θα υπάρχουν οι είλωτες που επωμίζονται όλο το βάρος των αδικιών και οι προνομιούχοι που δεν πληρώνουν ποτέ.
Όσον αφορά στην τροπολογία Καιρίδη, οι μεταναστευτικές ροές αυξήθηκαν το τελευταίο έτος κατά 300%,  γεγονός που καταδεικνύει αφενός την ανικανότητα της κυβέρνησης να τις ελέγξει, αφετέρου το μήνυμα που έλαβαν πολλοί ότι στην χώρα μας σχεδιάζεται η νομιμοποίηση της παράνομης μετανάστευσης.

Ομιλία του Νικόλαου Βρεττού, βουλευτή Β3 Νοτίου Τομέα Αθηνών της ΝΙΚΗΣ, για το νομοσχέδιο του Υπουργείου Εργασίας και Κοινωνικής Ασφάλισης με τίτλο «Αναμόρφωση επαγγελματικής ασφάλισης, εξορθολογισμός ασφαλιστικής νομοθεσίας, συνταξιοδοτικές ρυθμίσεις, σύστημα διορισμού και προσλήψεων των εκπαιδευτικών της δημόσιας υπηρεσίας απασχόλησης και λοιπές διατάξεις» (18.22.23)."
Επιλογή Διοικητή Πολιτικής Αεροπορίας,"Την κομματοκρατία αυτή που είναι η βασική αιτία της κακοδαιμονίας του νεοελληνικού κράτους, η ΝΙΚΗ αντιμάχεται σθεναρά και την αποκρούει, όπου τη συναντήσει.

Η εισήγηση του κ. Γεώργιου Αποστολάκη, βουλευτή Επικρατείας της ΝΙΚΗΣ, στη Ειδική Μόνιμη Επιτροπή Θεσμών και Διαφάνειας για το διορισμό στις θέσεις Διοικητή και Υποδιοικητών της Υπηρεσίας Πολιτικής Αεροπορίας (18/12/2023)."
Καιρίδης: ο Υπουργός της νομιμοποίησης των παράνομων μεταναστών,"Αιφνιδιαστική η τροπολογία της νομιμοποίησης των παράνομων μεταναστών, παρόλο που προεκλογικά ο κ. Μητσοτάκης είχε πει ότι δεν πρόκειται να προχωρήσει σε νομιμοποιήσεις. 
Κατόπιν επιλέγει ως υπουργό μεταναστευτικής πολιτικής για να συνομιλεί με την Τουρκία , τον άνθρωπο με τον πιο αντεθνικό και εθνομηδενιστικό λόγο. 
Οι βολές του κατά της ΝΙΚΗΣ ομοιάζουν με τα υβριστικά συνθήματα των αντιεξουσιαστών που επιτέθηκαν στον πρόεδρό μας, γεγονός το οποίο δεν έχει καταδικάσει ακόμα η κυβέρνηση.

Ομιλία του Σπύρου Τσιρώνη, βουλευτή Αχαΐας της ΝΙΚΗΣ, για το νομοσχέδιο του Υπουργείου Εργασίας και Κοινωνικής Ασφάλισης με τίτλο «Αναμόρφωση επαγγελματικής ασφάλισης, εξορθολογισμός ασφαλιστικής νομοθεσίας, συνταξιοδοτικές ρυθμίσεις, σύστημα διορισμού και προσλήψεων των εκπαιδευτικών της δημόσιας υπηρεσίας απασχόλησης και λοιπές διατάξεις» (18.22.23)."
"Δεξιοί, κεντρώοι και αριστεροί δέχεστε να καθυβρίζονται τα ιερά και τα όσια της πατρίδας μας;","Απίστευτο μένος προς τον Άγιο της καρδιάς μας.

Παρέμβαση του Νίκου Παπαδόπουλου, βουλευτή Β' Θεσσαλονίκης της ΝΙΚΗΣ, στην Ολομέλεια της Βουλής για το σχέδιο νόμου του Υπουργείου Εργασίας και Κοινωνικής Ασφάλισης «Αναμόρφωση επαγγελματικής ασφάλισης, εξορθολογισμός ασφαλιστικής νομοθεσίας, συνταξιοδοτικές ρυθμίσεις, σύστημα διορισμού και προσλήψεων των εκπαιδευτικών της δημόσιας υπηρεσίας απασχόλησης και λοιπές διατάξεις» (18/12/2023)."
Αποδεικνύετε την εμμονή σας σε κάθε τι εθνομηδενιστικό!,"Έχετε ψηφίσει μνημόνια μαζί με τα άλλα κόμματα. Έχετε καταστρέψει τη χώρα. Έχετε εξευτελίσει την Ελλάδα με κάθε τρόπο. Έχετε αποξενώσει τον Έλληνα από την περιουσία και από τη γη του και τον έχετε καταδικάσει στη φτώχεια. Έχετε διαλύσει την επαρχία και τον πρωτογενή τομέα. Έχετε οδηγήσει τα χωριά σε ερήμωση και έχετε εκδιώξει τα ελληνόπουλα στο εξωτερικό. 
Και τώρα αντί να διορθώσετε κάτι από τα λάθη σας, έρχεστε και λέτε στην ελληνική οικογένεια ότι θα αντικαταστήσετε τον ελληνικό πληθυσμό με παράνομους μετανάστες. 
Αυτά γιατί δεν τα είπατε προεκλογικά στους Έλληνες;

Ομιλία του Γεώργιου Ρούντα, βουλευτή Λάρισας της ΝΙΚΗΣ, στην Ολομέλεια της Βουλής για το σχέδιο νόμου του Υπουργείου Εργασίας και Κοινωνικής Ασφάλισης «Αναμόρφωση επαγγελματικής ασφάλισης, εξορθολογισμός ασφαλιστικής νομοθεσίας, συνταξιοδοτικές ρυθμίσεις, σύστημα διορισμού και προσλήψεων των εκπαιδευτικών της δημόσιας υπηρεσίας απασχόλησης και λοιπές διατάξεις» (18/12/2023)."
Με την σκανδαλώδη τροπολογία Καιρίδη μεθοδεύεται η διάλυση της εθνικής συνοχής,"Η μεταλλαγμένη ΝΔ και οι υπουργοί της, που παλαιότερα ήταν αντίθετοι στην εισβολή των λαθρομεταναστών, τώρα επιστρατεύουν όλες τους τις ικανότητες για να διαλύσουν την κοινωνική και εθνική συνοχή της πατρίδας μας με τις σκανδαλώδεις και μαζικές νομιμοποιήσεις παράνομων μεταναστών.
Η έκδοση των συντάξεων καθυστερεί απελπιστικά. Αντί να δοθούν κίνητρα για εργασία στους νέους και αξιοπρεπείς συντάξεις στους ηλικιωμένους συμβαίνει το παράδοξο να δίνονται κίνητρα στους ηλικιωμένους να εργαστούν!

Ομιλία του Νίκου Παπαδόπουλου, βουλευτή Β' Θεσσαλονίκης της ΝΙΚΗΣ, στην Ολομέλεια της Βουλής για το σχέδιο νόμου του Υπουργείου Εργασίας και Κοινωνικής Ασφάλισης «Αναμόρφωση επαγγελματικής ασφάλισης, εξορθολογισμός ασφαλιστικής νομοθεσίας, συνταξιοδοτικές ρυθμίσεις, σύστημα διορισμού και προσλήψεων των εκπαιδευτικών της δημόσιας υπηρεσίας απασχόλησης και λοιπές διατάξεις» (18/12/2023)."
Δεν θα επιτρέψουμε την ισλαμοποίηση της Ελλάδας,"Με φρενήρεις ρυθμούς επιτάχυνσης της διαδικασίας νομιμοποίησης των παράνομων μεταναστών. H κυβέρνηση προσπαθεί να τους εντάξει στην αγορά εργασίας πριν ακόμα ολοκληρωθεί η εξέταση των αιτημάτων τους. 
Αυτό σημαίνει στην πράξη ότι σκοπός της είναι να ριζώσουν στην πατρίδα μας, γεγονός που σημαίνει σημαντική αλλοίωση πληθυσμού ενώ ταυτόχρονα το μέτρο αυτό  λειτουργεί ως μαγνήτης για την αύξηση των ροών αλλά και τον αιτήσεων διεθνούς προστασίας.

Ομιλία της Ασπασίας Κουρουπάκη, βουλευτή Β1 Βορείου Τομέα Αθηνών, στην Ολομέλεια της Βουλής για το σχέδιο νόμου του Υπουργείου Εργασίας και Κοινωνικής Ασφάλισης «Αναμόρφωση επαγγελματικής ασφάλισης, εξορθολογισμός ασφαλιστικής νομοθεσίας, συνταξιοδοτικές ρυθμίσεις, σύστημα διορισμού και προσλήψεων των εκπαιδευτικών της δημόσιας υπηρεσίας απασχόλησης και λοιπές διατάξεις» (18/12/2023)."
Υπουργός της ακρίβειας στην κυβέρνηση της ακρίβειας,"Η κυβέρνηση σκοπεύει να επιδοτήσει υπεράκτια αιολικά πάρκα αδιαφορώντας για τις τοπικές κοινωνίες και τίς αρχές της τοπικής αυτοδιοίκησης οι οποίες αντιδρούν. Έχει βάλει σκοπό να καταστρέψει τις παραλίες με γιγάντια μεταλλικά μπάζα.
Στον υπουργό της ακρίβειας έχουμε να πούμε ότι ακόμα και ο ηλιακός θερμοσίφωνας πουλιέται πλέον στην διπλάσια τιμή και έγινε προϊόν πολυτέλειας για τα λαϊκά νοικοκυριά.

Παρέμβαση του Νικόλαου Βρεττού, βουλευτή Β3 Νοτίου Τομέα Αθηνών της ΝΙΚΗΣ, στην Ολομέλεια της Βουλής για το σχέδιο νόμου του Υπουργείου Οικονομίας και Οικονομικών «Κύρωση του Κρατικού Προϋπολογισμού οικονομικού έτους 2024» (15/12/2023)."
Ειρήνη υμίν!,"Με αφορμή τις θεολογικού τύπου διενέξεις στο κοινοβούλιο έχουμε να πούμε το εξής: Όσα δεν μπορεί να αντιμετωπίσει ο άνθρωπος τα εναποθέτει στον Θεό.
Η παρέμβαση της ΝΙΚΗΣ τελικά, που ο λαός την έστειλε στο κοινοβούλιο με ένα ανεξήγητο και απρόσμενο τρόπο, μόνο καλό έχει φέρει διότι καταδεικνύει την αποτυχία του πολιτικού συστήματος, αποτυχία που μόνο με υπαρξιακές αναζητήσεις μπορεί να αντιμετωπιστεί.

Παρέμβαση του Νικολάου Βρεττού, βουλευτή Β3 Νοτίου Τομέα Αθηνών της ΝΙΚΗΣ, στην Ολομέλεια της Βουλής για το σχέδιο νόμου του Υπουργείου Οικονομίας και Οικονομικών «Κύρωση του Κρατικού Προϋπολογισμού οικονομικού έτους 2024» (15/12/2023)."
«κ.Τσακαλώτο εσείς δείχνατε αγάπη όταν ψηφίζατε μνημόνια;» - Δημήτρης Νατσιός,"«κ. Τσακαλώτο, εσείς δείχνατε αγάπη όταν ψηφίζατε μνημόνια που έστειλαν στον τάφο πολλούς συμπολίτες μας ή τα παιδιά πολλών οικογενειών της Ελλάδος στο εξωτερικό, βυθίζοντας στη θλίψη και την απόγνωση τις οικογένειές τους; Εσείς δείχνατε αγάπη, αφού μας κατηγορήσατε ότι μας λείπει αγάπη, όταν μειώνατε τις συντάξεις;
Να μας απαντήσετε».

Από την ομιλία του Δημήτρη Νατσιού, προέδρου της ΝΙΚΗΣ, στην Ολομέλεια της Βουλής για το σχέδιο νόμου του Υπουργείου Οικονομίας και Οικονομικών «Κύρωση του Κρατικού Προϋπολογισμού οικονομικού έτους 2024» (17/12/2023)."
