Title,Description
Πώς φτάσαμε μέχρι την Ψηφιακή Ταυτότητα και τον Μοναδικό Προσωπικό Αρ. Πολίτη - Γιώργος Αποστολάκης,"Η ομιλία για τις νέες ηλεκτρονικές ταυτότητες, του κ. Γιώργου Αποστολάκη, Επίτιμου Αντιπροέδρου Αρείου Πάγου και βουλευτή Επικρατείας της ΝΙΚΗΣ, στην μεγάλη εκδήλωση της ΝΙΚΗΣ στο Βελλίδειο (21/9/2023)."
«Πλήγμα στην οικογενειακή ζωή το εργασιακό νομοσχέδιο» - Γιώργος Ρούντας,"Παρέμβαση του Γιώργου Ρούντα, βουλευτή Λάρισας και αντιπροέδρου της ΝΙΚΗΣ, στην ολομέλεια της Βουλής, για το σχέδιο νόμου του Υπουργείο Εργασίας και Κοινωνικής Ασφάλιση (21/9/2023)."
Η κεντρική ομιλία του Δημήτρη Νατσιού στο Βελλίδειο,"Παρακολουθήστε την κεντρική ομιλία στη Θεσσαλονίκη, του προέδρου της ΝΙΚΗΣ κ. Δημήτρη Νατσιού, που θα πραγματοποιήθηκε την Πέμπτη 21 Σεπτεμβρίου 2023, στο Βελλίδειο Συνεδριακό Κέντρο."
«Δεν ζούμε για να δουλεύουμε» - Σπύρος Τσιρώνης,"Η ομιλία στην ολομέλεια της Βουλής του Σπύρου Τσιρώνη, βουλευτή Αχαΐας της ΝΙΚΗΣ, για το σχέδιο νόμου του Υπουργείο Εργασίας και Κοινωνικής Ασφάλιση (21/9/2023)."
Κεντρική εισήγηση για το νέο εργασιακό νομοσχέδιο - Ασπασία Κουρουπάκη,"Η ομιλία στην ολομέλεια της Βουλής της Ασπασίας Κουρουπάκη, βουλευτού Β1 Βορείου Τομέα Αθηνών της ΝΙΚΗΣ, για το σχέδιο νόμου του Υπουργείο Εργασίας και Κοινωνικής Ασφάλισης, στην οποία δήλωσε ότι η ΝΙΚΗ το καταψηφίζει (21/9/2023)."
«Εργασιακός μεσαίωνας!»: ο Δημήτρης Νατσιός για το εργασιακό νομοσχέδιο,"Η ομιλία του Προέδρου της ΝΙΚΗΣ Δημήτρη Νατσιού στη Βουλή για το σχέδιο νόμου του Υπουργείο Εργασίας και Κοινωνικής Ασφάλισης, στην οποία δηλώνει ότι η ΝΙΚΗ το καταψηφίζει (21/9/2023)."
Η ΝΙΚΗ για τους πλημμυροπαθείς παραγωγούς της Θεσσαλίας,"Επίκαιρη ερώτηση του κ. Νικόλαου  Βρεττού, βουλευτή Β3 Νότιου Τομέα Αθηνών της ΝΙΚΗΣ, με θέμα την αποκατάσταση της προσβασιμότητας στο κεντρικό και αγροτικό δίκτυο του Πηλίου, προκειμένου να διασωθεί η μη καταστραφείσα παραγωγή μήλων (18/9/2023)."
«Ένας απλός μηχανικός είμαι»: απίστευτη απάντηση υφυπουργού για αντιπλημμυρικά έργα στη Θεσσαλία,"Επίκαιρη ερώτηση του κ. Γεώργιου Αποστολάκη, βουλευτή Επικρατείας της ΝΙΚΗΣ, για την μη υλοποίηση αντιπλημμυρικών έργων στις περιοχές Καρδίτσας και Μουζακίου που εξαγγέλθηκαν το 2020 μετά την κακοκαιρία «Ιανός» (18/9/2023)."
Λιβύη: ερωτήματα της ΝΙΚΗΣ για τις συνθήκες του τραγικού συμβάντος,"Υπήρχαν εγγυήσεις ασφαλείας και προστασίας της αποστολής μας στη Λιβύη;
   
Άλλη μια ημέρα που η χώρα μας  θρηνεί  παιδιά της. Μια συμφορά ακόμα έρχεται να προστεθεί στους δύσκολους καιρούς που περνά η πατρίδα μας εδώ και μήνες.

Τρία στελέχη των Ενόπλων Δυνάμεων και δύο διερμηνείς έχασαν τη ζωής τους σε μια αποστολή που γεννά ερωτηματικά ως προς τις εγγυήσεις ασφάλειας και προστασίας της.

Η ΝΙΚΗ ζητά από την Κυβέρνηση να ενημερώσει τον Ελληνικό Λαό για τις ακριβείς συνθήκες του δυστυχήματος (;) και αναμένει απαντήσεις στους εξής προβληματισμούς της:

- Γιατί στην αρχική ανακοίνωση του ΓΕΕΘΑ γινόταν λόγος μόνο για «ελαφρούς τραυματισμούς» την ίδια ώρα που διεθνή μέσα ενημέρωσης έκαναν λόγο για νεκρούς και τραυματίες;
- Γιατί μέχρι και σήμερα το πρωί στα επίσημα ανακοινωθέντα της Κυβέρνησης αλλά και των ΜΜΕ δεν αναφέρεται ότι στα θύματα υπάρχουν πολλοί ακόμη Έλληνες τραυματίες και μάλιστα πέντε εξ αυτών σε κρίσιμη κατάσταση;
- Ποια ήταν η σχεδίαση για την εκτέλεση μίας αποστολής σε μία χώρα στην οποία επικρατεί το χάος, μαστίζεται από εμφύλιες συγκρούσεις και εκ των πραγμάτων υπήρχε θέμα ασφάλειας του προσωπικού;
- Γιατί στο twitter του Α/ΓΕΕΘΑ στις 17 Σεπ 23 διαφημιζόταν η εκκίνηση της αποστολής βοήθειας στη Λιβύη με  άνδρες των ειδικών δυνάμεων; Δεν ήταν αυτό απόρρητη πληροφορία για την ασφάλεια της αποστολής;
- Ποιες ήταν οι πραγματικές συνθήκες πρόκλησης του δυστυχήματος (;), στο οποίο καταστράφηκε ένα λεωφορείο, καθόσον από τις μέχρι τώρα αναφορές διαφαίνεται ότι δεν προκλήθηκε από την σύγκρουση με το άλλο όχημα; Εξετάζεται το θέμα τρομοκρατικής ενέργειας;

Καλούμε την Κυβέρνηση να ενημερώσει άμεσα τον Ελληνικό Λαό για όλα τα παραπάνω και διερωτόμαστε: Ποιος από τους υποτιθέμενους «φίλους» μας έστειλε βοήθεια στη Θεσσαλία; Οι περίφημες ΜΚΟ που υποδέχονται μετανάστες…που ήταν ; Γιατί εμείς εκεί;

Η ΝΙΚΗ στην νέα αυτή τραγωδία εκφράζει τα θερμά της συλλυπητήρια στις οικογένειες των εκλιπόντων και εύχεται ο Πανάγαθος Θεός να αναπαύσει τις ψυχές τους και να παρηγορεί τους οικείους και συγγενείς τους."
«Νεολαία αιχμάλωτη των 5 αισθήσεων; Ας δώσουμε κάτι παραπάνω στα παιδιά μας!»,"Ομιλία του κ. Νίκου Παπαδόπουλου, βουλευτή Β' Θεσσαλονίκης της ΝΙΚΗΣ,   πολύτεκνου πατέρα 6 παιδιών και δρ. ιατρού θωρακοκαρδιοχειρουργού, επί της Διεθνούς Σύμβασης του Υπουργείου Παιδείας, Θρησκευμάτων και Αθλητισμού με τίτλο ""Κύρωση της Συμφωνίας Έδρας μεταξύ της Κυβέρνησης της Ελληνικής Δημοκρατίας και του Ευρωπαϊκού Κέντρου για την Ανάπτυξη της Επαγγελματικής Κατάρτισης (CEDEFOP)"" (14/9/2023)."
Η ΝΙΚΗ ενάντια στο πλιάτσικο από το υπερταμείο,"Η Κυβέρνηση προκειμένου να διευκολύνει το έργο της Τρόικα και συνεχίζοντας το ξεπούλημα της εθνικής δημόσιας περιουσίας έφερε τα άρθρα 33-35 που αφορούν το ΤΑΙΠΕΔ με σκοπό να διευκολύνει τη μεταβίβαση της εθνικής περιουσίας μας μέσω μετοχών στο Χρηματιστήριο Αθηνών και στα λοιπά χρηματιστήρια. Αυτό σημαίνει πως σε λίγο η Κυβέρνηση, δεν θα γνωρίζει ποιος είναι ο αγοραστής ιδιοκτήτης στρατηγικών υποδομών της χώρας.

Η ομιλία του κ. Γεώργιου Ρούντα, αντιπροέδρου της ΝΙΚΗΣ και βουλευτού Λαρίσης , στην ολομέλεια της Βουλής, για το σχέδιο νόμου του Υπ. Εθνικής Οικονομίας και Οικονομικών, στην οποία δήλωσε ότι η ΝΙΚΗ το καταψηφίζει (4/9/2023)."
«Αδιαντροπιά και αδικία οι αρρώστιες της πολιτείας»: ο Δ. Νατσιός για τις πλημμύρες,"Ομιλία του προέδρου της ΝΙΚΗΣ Δημήτρη Νατσιού στην ολομέλεια της Βουλής για το σχέδιο νόμου του Υπ. Δικαιοσύνης με τίτλο ""Επιτάχυνση διαδικασιών στελέχωσης και λειτουργίας Δικαστικής Αστυνομίας"" (13/9/2023)."
«Αξιοκρατία όχι κομματοκρατία»: η θέση της ΝΙΚΗΣ για την Δικαστική Αστυνομία,"Η ομιλία στην ολομέλεια της Βουλής του κ. Γεώργιου Αποστολάκη, βουλευτού Επικρατείας της ΝΙΚΗΣ, για το σχέδιο νόμου του Υπ. Δικαιοσύνης με τίτλο ""Επιτάχυνση διαδικασιών στελέχωσης και λειτουργίας Δικαστικής Αστυνομίας"", στην οποία δήλωσε ότι η ΝΙΚΗ το καταψηφίζει (13/9/2023)."
ΤΑ ΑΙΣΧΗ ΤΩΝ ΣΧΟΛΙΚΩΝ ΒΙΒΛΙΩΝ - Απαράδεκτη η υφυπουργός,"Ο πρόεδρος της ΝΙΚΗΣ Δημήτρης Νατσιός ενημερώνει την υφυπουργό Παιδείας Δόμνα Μιχαηλίδου για τις αθλιότητες και τα ψεύδη που περιέχουν τα σχολικά βιβλία βάσει της 35ετούς εμπειρίας του, ως δάσκαλος στις σχολικές αίθουσες.
Αίσθηση προκάλεσε η ειρωνική και απαξιωτική στάση της νεαρής υφυπουργού και η γενικότερη άγνοιά της στο θέμα. Η ξύλινη απάντηση του Υπουργείου Παιδείας προδίδει ότι δεν είναι διατεθειμένο να αντικαταστήσει τα αισχρά βιβλία, ούτε να έρθουν σε λογοδοσία οι υπεύθυνοι για αυτά. Φαίνεται ότι αυτό θα πρέπει να το πράξει η ίδια η ΝΙΚΗ, όταν ο ελληνικός λαός της δώσει κυβερνητική εντολή.
Τέλος, θα ήταν χρήσιμο να ενημερωθεί η νεαρή υφυπουργός ότι όταν απευθύνεται σε πρόεδρο κόμματος θα πρέπει να προσέχει τις προσφωνήσεις που χρησιμοποιεί."
"Πλημμύρες, ""κονδύλια"", παιδεία και σχολικά βιβλία - Ο Δ. Νατσιός από το βήμα της Βουλής","Η ομιλία του προέδρου της ΝΙΚΗΣ Δημήτρη Νατσιού, στη Διαρκή Επιτροπή Μορφωτικών Υποθέσεων (12/9/2023)."
«Σμίλεψε δάσκαλε ψυχές» - Ο Δ. Νατσιός στο σχολείο που δίδαξε επί 20 χρόνια,"Στο 4ο Δημοτικό Σχολείο Κιλκίς, σχολείο στο οποίο ο πρόεδρος της ΝΙΚΗΣ Δημήτρης Νατσιός δίδαξε επί 20 χρόνια  και το οποίο άφησε για να μπει στην αίθουσα του Κοινοβουλίου, βρέθηκε την Δευτέρα 11.9.2023, όπου συμμετείχε στην ακολουθία του αγιασμού για την έναρξη της νέας σχολικής χρονιάς."
«ΜΑΦΙΑ ΤΟΥ ΧΑΛΚΟΥ»: 5 έτη κυβερνητική επιλογή ή επιτελική ανικανότητα;,"Επίκαιρη ερώτηση του Νίκου Βρεττού, βουλευτή Β3 Νοτίου Τομέα Αθηνών της ΝΙΚΗΣ, με θέμα τη «μαφία του χαλκού» την οποία βιώνει καθημερινά η κοινωνία μας, με τραγικά αποτελέσματα (11/9/2023).

Η επίκαιρη ερώτηση κατατέθηκε στις 4/9/2023 και απαντήθηκε στις 11/9/2023."
«Λάμπει μες στην λάσπη η ΑΝΘΡΩΠΙΑ»: Δηλώσεις του Προέδρου της ΝΙΚΗΣ Δ. Νατσιού από τη Θεσσαλία,"Αφουγκραζόμενοι τον πόνο των αδελφών μας, δυο κλιμάκια της ΝΙΚΗΣ κατευθύνθηκαν χθες προς τις περιοχές όλων των νομών της Θεσσαλίας. 

Το 1ο κλιμάκιο αποτελείτο από τον πρόεδρο κ. Δημήτριο Νατσιό, τον βουλευτή Λάρισας και αντιπρόεδρο του Κινήματος κ. Γεώργιο Ρούντα, τον βουλευτή Β2 Δυτικού Τομέα Αθηνών κ. Ανδρέα Βορύλλα, και μέλη της Τοπικής Κοινότητας ΝΙΚΗΣ Μαγνησίας.

Το 2ο κλιμάκιο, αποτελείτο από τον βουλευτή Επικρατείας κ. Γεώργιο Αποστολάκη, τον βουλευτή Β3 Νοτίου Τομέα Αθηνών κ. Νικόλαο Βρεττό και μέλη της Τοπικής Κοινότητας Καρδίτσας.

Οι δύο αποστολές παρέδωσαν στους τοπικούς φορείς και τους πληγέντες κατοίκους φορτία από παλέτες με εμφιαλωμένο νερό.

H ΝΙΚΗ ξεκίνησε κεντρικά τη βοήθεια στους πλημμυροπαθείς της Θεσσαλίας με αποστολή εμφιαλωμένου νερού, το οποίο έχουν άμεση ανάγκη. Η πρόσκληση για βοήθεια επεκτείνεται πλέον στις Τοπικές Κοινότητες των Φίλων της ΝΙΚΗΣ. Οι συμπατριώτες μας στη Θεσσαλία έχουν ανάγκες σε εμφιαλωμένο νερό, χυμούς, τρόφιμα μακράς διαρκείας, ρουχισμό, κάλτσες, κουβέρτες, φάρμακα. Άλλοι, ακόμη περισσότερο, έχουν ανάγκη στέγης.

ΚΑΛΟΥΜΕ κάθε φίλο και φίλη της ΝΙΚΗΣ που θέλει και μπορεί να βοηθήσει, να έλθει σε επικοινωνία με τις Τοπικές Κοινότητες της ΝΙΚΗΣ της περιοχής του (https://nikh.gr/i-niki/topikes-koinotites) με: 
1. Συλλογή βοήθειας 
2. Διάθεση αποθηκευτικού χώρου συλλογής της βοήθειας, με υπεύθυνο και ώρες λειτουργίας. 
3. Διάθεση μέσων αποστολής της βοήθειας.
4. Προσφορά φιλοξενίας σε οικογένειες πληγέντων συμπατριωτών μας που καταστράφηκαν τα σπίτια τους."
"«Αδιανόητη η δήλωση του κ. Βαρβιτσιώτη, έλλειμμα πολιτισμού και παιδείας!» - Γεώργιος Ρούντας","Εισήγηση του κ. Γεώργιου Ρούντα στην Διαρκή Επιτροπή Δημόσιας Διοίκησης, Δημόσιας Τάξης και Δικαιοσύνης με θέμα το σχέδιο νόμου του Υπουργείου Δικαιοσύνης «Επιτάχυνση διαδικασιών στελέχωσης και λειτουργίας Δικαστικής Αστυνομίας - Τροποποιήσεις ν. 4963/2022 και άλλες ρυθμίσεις του Υπουργείου Δικαιοσύνης» (7/9/2023)."
«ΑΣΤΡΟΛΟΓΟΙ και ΠΑΙΔΕΡΑΣΤΕΣ διδάσκονται στα σχολικά βιβλία!»,"Ο Πρόεδρος της ΝΙΚΗΣ, κ. Δημήτρης Νατσιός καλεσμένος στην ""Κοινωνία Ώρα Mega"", αναδεικνύει τις αστοχίες των σχολικών βιβλίων (5/9/2023)."
"«Μ. Βρετανία, Εσθονία, Ελβετία απέρριψαν τις ταυτότητες»","Ο Πρόεδρος της ΝΙΚΗΣ, κ. Δημήτρης Νατσιός καλεσμένος στην ""Κοινωνία Ώρα Mega"", απαντάει για το ζήτημα των νέων ηλεκτρονικών ταυτοτήτων."
"""Ελευθερία και Δημοκρατία"" το μήνυμα από την απελευθέρωση της Λάρισας","Το Δημοκρατικό Πατριωτικό Κίνημα ΝΙΚΗ και ο βουλευτής Λάρισας της ΝΙΚΗΣ, κ. Γεώργιος Ρούντας, συμμετείχε την Κυριακή 3 Σεπτεμβρίου 2023, στη δοξολογία που έγινε στον Ιερό Ναό της Αναλήψεως Λάρισας με αφορμή την απελευθέρωση της πόλης από τους Τούρκους στις 31 Αυγούστου 1881, μετά από υποταγή 458 ετών. Ακολούθησε κατάθεση στεφάνων στο μνημείο που βρίσκεται στο διπλανό πάρκο της περιοχής."
"Οι σπατάλες της κυβέρνησης για ""δασοπροστασία""","Επίκαιρη ερώτηση του Τάσου Οικονομόπουλου, με θέμα τη χρήση μη Επανδρωμένων Αεροχημάτων (ΜΕΑ) στην επιτήρηση δασών (1/9/2023)."
«Φακέλωμα του πολίτη» οι νέες ταυτότητες. Ενημερωτική εκδήλωση της NIKHΣ στο ΣΕΦ,"Την Κυριακή 3 Σεπτεμβρίου, ώρα 19.30 στο Στάδιο Ειρήνης και Φιλίας (Σταθμός ΗΣΑΠ Φαλήρου) στην Συνεδριακή Αίθουσα «Μελίνα Μερκούρη» πραγματοποιήθηκε Επιστημονική Ενημερωτική Εκδήλωση της ΝΙΚΗΣ για το θέμα των νέων ταυτοτήτων.
Ομιλητές: Δ. Χιωτακάκος, Τ. Οικονομόπουλος, και ο Πρόεδρος της ΝΙΚΗΣ κ. Δημήτριος Νατσιός."
Φωτιές σε στρατόπεδα και τραυματισμοί! - Ο Υφ. Εθνικής Άμυνας δε λέει την αλήθεια,"Επίκαιρη ερώτηση του Γεώργιου Ρούντα με θέμα τον κίνδυνο καταστροφής στρατιωτικών εγκαταστάσεων από τις πυρκαγιές (1/9/2023).
""Το θέμα είναι πολύ σοβαρό, γιατί εάν δεν μπορούμε να ασφαλίσουμε μία αποθήκη πυρομαχικών και δίνουμε εντολή εκκένωσης στο προσωπικό, από φόβο μην έχουμε θύματα τότε πώς θα ασφαλίσουμε την χώρα σε περίοδο πολέμου;"""
"""ΑΦΑΝΤΟΣ ο Πρωθυπουργός για τους πυρόπληκτους!"" - Δευτερολογία Προέδρου ΝΙΚΗΣ στη Βουλή (31/8/2023)",
Όλη η αλήθεια για τις φωτιές - Ομιλία του Προέδρου της ΝΙΚΗΣ στη Βουλή (31/8/2023),
Τίθεται θέμα ΕΘΝΙΚΗΣ ΚΥΡΙΑΡΧΙΑΣ! - Ο Δ. Χιωτακάκος για τις νέες ηλεκτρονικές ταυτότητες,"Ο Δημήτρης Χιωτακάκος, δρ. Πληροφορικής & Τηλεπικοινωνιών, στέλεχος της ΝΙΚΗΣ, καλεσμένος στο ""STAR Κεντρικής Ελλάδας"" , σε μία συνέντευξη εφ' όλης της ύλης με την δημοσιογράφο κ. Λαθύρη, αναλύει τα πολύ σοβαρά ζητήματα που προκύπτουν με τις βάσεις δεδομένων των νέων ηλεκτρονικών ταυτοτήτων (25/8/2023)."
«Φακέλωμα του πολίτη» οι νέες ταυτότητες: Ενημερωτική Εκδήλωση της ΝΙΚΗΣ στις 3/9 στο ΣΕΦ,
"""ΔΕΝ ΘΕΛΟΥΜΕ ΝΑ ΓΙΝΟΥΜΕ ΚΙΝΑ!"" - Σκληρή κόντρα για τις νέες ηλεκτρονικές ταυτότητες","Ο Δημήτρης Χιωτακάκος, δρ. Πληροφορικής & Τηλεπικοινωνιών, στέλεχος της ΝΙΚΗΣ, καλεσμένος στο ""OneChannel"" στην εκπομπή ""ΕΔΩ"" του κ. Ζαχαρού, αναλύει τα προβλήματα που προκύπτουν από τις τεχνικές προδιαγραφές των νέων ηλεκτρονικών ταυτοτήτων (27/8/2023)."
Νέες ηλεκτρονικές ταυτότητες: ΣΟΒΑΡΑ και ΑΝΑΠΑΝΤΗΤΑ ερωτήματα!,"Ο Σπύρος Τσιρώνης, βουλευτής Αχαΐας της ΝΙΚΗΣ, καλεσμένος στην τηλεόραση του ΑΝΤ1, απαντά στα ερωτήματα των δημοσιογράφων σχετικά με την ανησυχία των πολιτών για τις νέες ηλεκτρονικές ταυτότητες. Αξιοσημείωτο είναι ότι δεν έλαβε απαντήσεις σε σοβαρά ερωτήματα που αφορούν την εθνική βάση δεδομένων όπου θα συγκεντρώνονται οι πληροφορίες και το ποιος θα διαχειρίζεται αυτή τη βάση."
Καταπέλτης για τις νέες ηλεκτρονικές ταυτότητες ο κ. Αποστολάκης,"Συνέντευξη του κ. Γεώργιου Αποστολάκη, βουλευτή Επικρατείας της ΝΙΚΗΣ, στο ραδιοφωνικό σταθμό Λέσχη 97.6 και στη δημοσιογράφο Ευαγγελία Σωτηρίου, με θέμα τις νέες ηλεκτρονικές ταυτότητες (24/8/2023)."
"""Οργανωμένο σχέδιο εμπρησμού"": ο Δημήτρης Νατσιός από τα πύρινα μέτωπα του Ν. Έβρου","Η δήλωση του Δημήτρη Νατσιού από τα πύρινα μέτωπα του Ν. Έβρου (23/8/23):
""Η κυβέρνηση να ζητήσει συγγνώμη από τον λαό μας γιατί τόσα χρόνια διακυβέρνησης δεν μπόρεσε να εκσυγχρονίσει τα μέσα πυρόσβεσης, να αποκτήσει σύγχρονα μέσα επιτήρησης και να αναθέσει στις εθνικές υπηρεσίες να αποτρέψουν τους επίδοξους εμπρηστές. Η ΝΙΚΗ εκφράζει την ευγνωμοσύνη της στην πυροσβεστική, τον στρατό μας, τα σώματα ασφαλείας, τους εθελοντές, οι οποίοι με αυταπάρνηση υπερασπίζονται τον βίο και το βιός του λαού μας. Θα σταθούμε δίπλα στον εμπερίστατο λαό της Θράκης μας."""
Γνώμονάς μας η ανθρώπινη αξιοπρέπεια: Η απάντηση της ΝΙΚΗΣ στο νομοσχέδιο του Υπ. Υγείας (27/7/2023),"Η ομιλία στην ολομέλεια της Βουλής της κ. Ασπασίας Κουρουπάκη, βουλευτού Β1 Βορείου Τομέα Αθηνών της ΝΙΚΗΣ, για το σχέδιο νόμου του Υπ. Υγείας, στην οποία δήλωσε ότι η ΝΙΚΗ το καταψηφίζει (27/7/2023)."
